{
  "schema_id": "asklegal.hk-regulatory.identity-decision-report",
  "schema_version": "1.0.0",
  "rule_id": "HKREG-IDENTITY-DECISION-001",
  "case_id": "HKREG-DET-IDN-016",
  "assertion_scope": "LOOKUP_VALID",
  "observed_decision": {
    "schema_id": "asklegal.hk-regulatory.identity-decision-result",
    "schema_version": "1.0.0",
    "rule_id": "HKREG-IDENTITY-DECISION-001",
    "case_id": "HKREG-DET-IDN-016",
    "outcome": "PASS",
    "reason": "LOOKUP_ENTRY_VALID",
    "record_action": "VALIDATE_ONLY",
    "traceability_action": "VALIDATE",
    "identity_consequences": [],
    "selected_search_record_ids": [],
    "predecessor_search_record_ids": [],
    "register_allocation_count": 0,
    "board_separation_valid": false,
    "lookup_valid": true,
    "lineage_valid": true,
    "traceability_revision_required": false,
    "cached_embedding_reuse_permitted": false,
    "quarantine_required": false,
    "violation_codes": [],
    "search_record_authorized": false,
    "embedding_authorized": false,
    "release_authorized": false,
    "serving_authorized": false,
    "deployment_authorized": false,
    "external_effects": "NONE"
  },
  "expected_decision": {
    "schema_id": "asklegal.hk-regulatory.identity-decision-result",
    "schema_version": "1.0.0",
    "rule_id": "HKREG-IDENTITY-DECISION-001",
    "case_id": "HKREG-DET-IDN-016",
    "outcome": "PASS",
    "reason": "LOOKUP_ENTRY_VALID",
    "record_action": "VALIDATE_ONLY",
    "traceability_action": "VALIDATE",
    "identity_consequences": [],
    "selected_search_record_ids": [],
    "predecessor_search_record_ids": [],
    "register_allocation_count": 0,
    "board_separation_valid": false,
    "lookup_valid": true,
    "lineage_valid": true,
    "traceability_revision_required": false,
    "cached_embedding_reuse_permitted": false,
    "quarantine_required": false,
    "violation_codes": [],
    "search_record_authorized": false,
    "embedding_authorized": false,
    "release_authorized": false,
    "serving_authorized": false,
    "deployment_authorized": false,
    "external_effects": "NONE"
  },
  "conformance_status": "PASS",
  "source_authorized": false,
  "provider_authorized": false,
  "release_authorized": false,
  "serving_authorized": false,
  "deployment_authorized": false,
  "external_effects": "NONE"
}
